state_name,state,congress,s_lower,s_upper,race_type,election_name,,voter_power,name of ballot,type of ballot,source,ballot notes
Alaska,2,,,,Ballot Initiative,Democracy Repair,,,Repeal Top-Four Ranked-Choice Voting Initiative,voting policy measure,https://ballotpedia.org/Alaska_2024_ballot_measures,repeal top-four RCV from 2020
Alaska,2,,,,Ballot Initiative,Direct Democracy,,,Minimum Wage Increase and Paid Sick Leave Initiative,minimum wage,https://ballotpedia.org/Alaska_2024_ballot_measures,increase to $15 and require paid sick leave
Arizona,4,,,,Ballot Initiative,state government,,,Proposition 135,state government,https://ballotpedia.org/Arizona_2024_ballot_measures,provide for legislature to terminate or alter state of emergency power
Arizona,4,,,,Ballot Initiative,Democracy Repair,,,Proposition 137,voting policy measure,https://ballotpedia.org/Arizona_2024_ballot_measures,"end term limits for state SC justices with terms of good behavior, ending retention elections under circumstances"
Arizona,4,,,,Ballot Initiative,Direct Democracy,,,Proposition 314,immigration,https://ballotpedia.org/Arizona_2024_ballot_measures,allow state and local police to arrest noncitizens
Arizona,4,,,,Ballot Initiative,Democracy Repair,,,Proposition 136,voting policy measure,https://ballotpedia.org/Arizona_2024_ballot_measures,provide for challenges to initiative measure or amendment with secretary of state
Arizona,4,,,,Ballot Initiative,Democracy Repair,,,Proposition 133,voting policy measure,https://ballotpedia.org/Arizona_2024_ballot_measures,provide for challenges to initiative measure or amendment with secretary of state
Arizona,4,,,,Ballot Initiative,Democracy Repair,,,Proposition 134,voting policy measure,https://ballotpedia.org/Arizona_2024_ballot_measures,create signature distribution requirement for citizen-initiated ballot measures
Arizona,4,,,,Ballot Initiative,Direct Democracy,,,Proposition 138,minimum wage,https://ballotpedia.org/Arizona_2024_ballot_measures,allow for tipped workers to be paid 25% less per hour if any tips were not less than minimum wage plus $2/hours worked
Arizona,4,,,,Ballot Initiative,Direct Democracy,,,Proposition 315,state government,https://ballotpedia.org/Arizona_2024_ballot_measures,"prohibit proposed rule from being effective if rule will increase regulatory costs by more that $500,000 within five years of implementation"
Arizona,4,,,,Ballot Initiative,Reproductive Rights,,,Right to Abortion Initiative,abortion,https://ballotpedia.org/Arizona_Right_to_Abortion_Initiative_(2024),Establish the fundamental right to abortion that the state may not interfere with before point of fetal viability
Arkansas,5,,,,Ballot Initiative,Reproductive Rights,,,Right to Abortion Initiative,abortion,https://ballotpedia.org/Arkansas_Right_to_Abortion_Initiative_(2024),Prohibit laws or policies restricting abortion access within 18 weeks from conception or other cases
California,6,,,,Ballot Initiative,Direct Democracy,,,Proposition 32,minimum wage,https://ballotpedia.org/California_2024_ballot_propositions,increase to $18
California,6,,,,Ballot Initiative,Civil Liberties,,,Proposition 3,lgbtq+,https://ballotpedia.org/California_2024_ballot_propositions,repeal proposition 8 and establish right to marry
Colorado,8,,,,Ballot Initiative,Democracy Repair,,,Independent Judicial Discipline Adjudicative Board Amendment,judicial,https://ballotpedia.org/Colorado_2024_ballot_measures,creates independent judicial discipline adjudicative board
Colorado,8,,,,Ballot Initiative,Civil Liberties,,,Remove Constitutional Same-Sex Marriage Ban Amendment,lgbtq+,https://ballotpedia.org/Colorado_2024_ballot_measures,remove provision of state constitution on same-sex marriage
Colorado,8,,,,Ballot Initiative,Reproductive Rights,,,Right to Abortion and Health Insurance Coverage Initiative,abortion,https://ballotpedia.org/Colorado_2024_ballot_measures,create right to abortion in state constitution and repeal provision banning use of public funds for abortion
Colorado,8,,,,Ballot Initiative,Democracy Repair,,,Ballot Initiative 310,voting policy measure,https://www.rankedvote.co/locations/colorado/final-four-open-all-candidate-primaries-ranked-choice-voting-in-colorado,use final-four all-candidate primaries and ranked-choice general elections for state and federal elections by 2028
Colorado,8,,,,Ballot Initiative,Civil Liberties,,,"Sales Tax on Firearms Dealers, Manufacturers, and Ammunition Vendors Measure",guns,https://ballotpedia.org/Colorado_2024_ballot_measures,"levy excise tax on gun and ammunition sales across dealers, manufacturers, vendors; fund other programs including crime victim services and education programs"
Connecticut,9,,,,Ballot Initiative,Democracy Repair,,,No-Excuse Absentee Voting Amendment,voting policy measure,https://ballotpedia.org/Connecticut_2024_ballot_measures,authorize state legislature to provide no-excuse absentee voting
District of Columbia,11,,,,Ballot Initiative,Democracy Repair,,,Initiative 83: the Ranked-Choice Voting Initiative,voting policy measure,"https://ballotpedia.org/Washington,_D.C.,_Initiative_83,_Ranked-Choice_Voting_Initiative_(November_2024)",create a semi-open primary system in addition to RCV
Florida,12,,,,Ballot Initiative,Democracy Repair,,,Amendment 1,voting policy measure,https://ballotpedia.org/Florida_2024_ballot_measures,"change to partisan elections on school board, general, and primary elections beginning 2026"
Florida,12,,,,Ballot Initiative,Civil Liberties,,,Amendment 3,marijuana,https://ballotpedia.org/Florida_2024_ballot_measures,legalize marijuana for 21 and older adults
Florida,12,,,,Ballot Initiative,Reproductive Rights,,,Amendment 4,abortion,https://ballotpedia.org/Florida_2024_ballot_measures,establish constitutional right to abortion before fetal viability (estimated around 24 weeks) or when necessary for patient's health
Florida,12,,,,Ballot Initiative,Democracy Repair,,,Amendment 6,campaign financing,https://ballotpedia.org/Florida_2024_ballot_measures,repeal constitutional provision providing for public campaign financing for candidates
Georgia,13,,,,Ballot Initiative,Direct Democracy,,,Tax Court Amendment (HR 598),judicial,https://ballotpedia.org/Georgia_2024_ballot_measures,provide georgia tax court with statewide judicial power
Hawaii,15,,,,Ballot Initiative,Democracy Repair,,,Judicial Appointments and Confirmations Amendment,judicial,https://ballotpedia.org/Hawaii_2024_ballot_measures,change process for appointing and confirming district court judges to mirror SC and other higher court judges
Hawaii,15,,,,Ballot Initiative,Civil Liberties,,,Remove Legislative Authority to Limit Marriage to Opposite-Sex Couples Amendment,lgbtq+,https://ballotpedia.org/Hawaii_2024_ballot_measures,remove provision of state constitution on same-sex marriage
Idaho,16,,,,Ballot Initiative,Democracy Repair,,,Citizenship Voting Requirement for Voting Amendment,voting policy measure,https://ballotpedia.org/Idaho_2024_ballot_measures,amend idaho constitution to provide that only a citizen of the United States can vote in the state
Idaho,16,,,,Ballot Initiative,Democracy Repair,,,Top-Four Ranked-Choice Voting Initiative,voting policy measure,https://ballotpedia.org/Idaho_2024_ballot_measures,replace partisan primaries with open top-four primaries across races and establish ranked-choice voting for general elections
Illinois,17,,,,Ballot Initiative,reproductive health,,,Assisted Reproductive Healthcare Advisory Question,reproductive health,https://ballotpedia.org/Illinois_2024_ballot_measures,advise state officials on whether to provide for reproductive treatments to be covered by any health insurance plan
Illinois,17,,,,Ballot Initiative,Democracy Repair,,,Penalties for Candidate Interference with Election Worker's Duties Advisory Question,civil,https://ballotpedia.org/Illinois_2024_ballot_measures,advise state officials on whether to establish civil penalties for election interference
Indiana,18,,,,Ballot Initiative,Direct Democracy,,,Remove Superintendent of Public Instruction from Gubernatorial Line of Succession Amendment,state government,https://ballotpedia.org/Indiana_2024_ballot_measures,remove the superintendent of public instruction for gubernatorial succession
Iowa,19,,,,Ballot Initiative,Democracy Repair,,,Require Citizenship to Vote in State Elections and Allow 17-year-olds to Vote in Primaries Amendment,voting policy measure,https://ballotpedia.org/Iowa_2024_ballot_measures,changes constitution to only citizens being able to vote and provides 17 year olds who will be 18 can vote
Iowa,19,,,,Ballot Initiative,Direct Democracy,,,Gubernatorial Succession Amendment,state government,https://ballotpedia.org/Iowa_2024_ballot_measures,"Provides that lieutenant governor assumes office of governor for remainder of term if governor dies, resigns, or is removed"
Kentucky,21,,,,Ballot Initiative,Democracy Repair,,,Citizenship Requirement for Voting Amendment,voting policy measure,https://ballotpedia.org/2024_ballot_measures,require U.S. citizenship to be able to vote in the state
Maine,23,,,,Ballot Initiative,Democracy Repair,,,Campaign Contribution Limits Initiative,campaign financing,https://ballotpedia.org/Maine_2024_ballot_measures,limit campaign contributions to $5000 from individuals and PACs that make independent expenditures
Maryland,24,,,,Ballot Initiative,Reproductive Rights,,,Right to Reproductive Freedom Amendment,abortion,https://ballotpedia.org/Maryland_2024_ballot_measures,establishes right to reproductive freedom in state constitution
Massachusetts,25,,,,Ballot Initiative,Direct Democracy,,,Authorization of State Auditor to Audit General Court Initiative,state government,https://ballotpedia.org/Massachusetts_2024_ballot_measures,authorize state auditor to audit state legislature and remove some regulations regarding auditing
Massachusetts,23,,,,Ballot Initiative,Direct Democracy,,,Minimum Wage for Tipped Employees Initiative,minimum wage,https://ballotpedia.org/Massachusetts_2024_ballot_measures,gradually increase minimum wage for tipped workers up to 2029
Missouri,29,,,,Ballot Initiative,Democracy Repair,,,Require Citizenship to Vote and Prohibit Ranked-Choice Voting Amendment,voting policy measure,https://ballotpedia.org/Missouri_2024_ballot_measures,establish that only citizens who are Missouri residents can vote and prohibits RCV
Nebraska,31,,,,Ballot Initiative,Reproductive Rights,,,Right to Abortion Initiative,abortion,https://ballotpedia.org/Nebraska_Right_to_Abortion_Initiative_(2024),establish a fundamental right to abortion
Nevada,32,,,,Ballot Initiative,Direct Democracy,,,Question 1,state government,https://ballotpedia.org/Nevada_2024_ballot_measures,remove constitutional status of Board of Regents to allow state legislature to review and change governing organization of state universities
Nevada,32,,,,Ballot Initiative,Direct Democracy,,,Question 2,disability services,https://ballotpedia.org/Nevada_2024_ballot_measures,"revise state constitutional language related to public entities that benefit individuals with mental illness, blindness, or deafness"
Nevada,32,,,,Ballot Initiative,Democracy Repair,,,Question 3,voting policy measure,https://ballotpedia.org/Nevada_2024_ballot_measures,provide for open top-5 primaries and RCV for general elections
Nevada,32,,,,Ballot Initiative,Reproductive Rights,,,Right to Abortion Initiative,abortion,https://ballotpedia.org/Nevada_2024_ballot_measures,"provide a state constitutional right to an abortion, providing for state to regulate after fetal viability"
New Hampshite,33,,,,Ballot Initiative,Democracy Repair,,,Increase Mandatory Judicial Retirement Age Amendment,judicial,https://ballotpedia.org/New_Hampshire_2024_ballot_measures,increase mandatory judicial retirement age from 70 to 75
New Mexico,35,,,,Ballot Initiative,Democracy Repair,,,Judicial Nominating Commission Amendment,judicial,https://ballotpedia.org/New_Mexico_2024_ballot_measures,authorize designee of the dean of UNM law school to serve as chair of judicial nomination process
New York,36,,,,Ballot Initiative,Democracy Repair,,,Ithaca Ranked Choice Voting and Combined Primaries,voting policy measure,https://ithacavoice.org/2024/06/campaign-aims-to-put-ranked-choice-voting-to-a-referendum-in-ithaca/,"apply open primaries and RCV to all primary, general, and special elections for Mayor, Council, and City Judges in Ithaca effective 2026"
New York,36,,,,Ballot Initiative,Civil Liberties,,,Equal Protection of Law Amendment,discrimination,https://ballotpedia.org/New_York_2024_ballot_measures,"provide that people cannot be denied rights based on their ""ethnicity, national origin, age, and disability"" or ""sex, including sexual orientation, gender identity, gender expression, pregnancy, pregnancy outcomes, and reproductive healthcare and autonomy"""
New York,36,,,,Ballot Initiative,Reproductive Rights,,,Equal Protection of Law Amendment,abortion,https://ballotpedia.org/New_York_2024_ballot_measures,"provide that people cannot be denied rights based on their ""ethnicity, national origin, age, and disability"" or ""sex, including sexual orientation, gender identity, gender expression, pregnancy, pregnancy outcomes, and reproductive healthcare and autonomy"""
North Carolina,37,,,,Ballot Initiative,Democracy Repair,,,Citizenship Requirement for Voting Amendment,voting policy measure,https://ballotpedia.org/North_Carolina_2024_ballot_measures,provide in state constitution that only a citizen (rather than every citizen) of the US may vote
North Dakota,38,,,,Ballot Initiative,disability services,,,Constitutional Measure 1,disability services,https://ballotpedia.org/North_Dakota_2024_ballot_measures,"adjusting state constitution language to support those with mental illness, developmental disabilities, and deafness"
North Dakota,38,,,,Ballot Initiative,Democracy Repair,,,Constitutional Measure 2,voting policy measure,https://ballotpedia.org/North_Dakota_2024_ballot_measures,establish a single-subject rule for initiatives; increase the signature requirement for constitutional initiatives; and require constitutional initiatives to be approved at two elections
Oklahoma,40,,,,Ballot Initiative,Democracy Repair,,,Citizenship Requirement for Voting Amendment,voting policy measure,https://ballotpedia.org/Oklahoma_2024_ballot_measures,provide in state constitution that only a citizen (rather than every citizen) of the US may vote
Oklahoma,40,,,,Ballot Initiative,Direct Democracy,,,Minimum Wage Increase Initiative,minimum wage,https://ballotpedia.org/Oklahoma_Minimum_Wage_Increase_Initiative_(2024),gradually increase minimum wage up to 2030
Oregon,41,,,,Ballot Initiative,Democracy Repair,,,Impeachment of Elected State Executives Amendment,state government,https://ballotpedia.org/Oregon_2024_ballot_measures,alow legislature to impeach elected state executives
Oregon,41,,,,Ballot Initiative,Democracy Repair,,,Ranked-Choice Voting for Federal and State Elections Measure,voting policy measure,https://ballotpedia.org/Oregon_2024_ballot_measures,establish RCV for federal and state offices
Rhode Island,44,,,,Ballot Initiative,Democracy Repair,,,Constitutional Convention Question,state government,https://ballotpedia.org/Rhode_Island_2024_ballot_measures,call for state constitutional convention to be held
South Carolina,45,,,,Ballot Initiative,Democracy Repair,,,Citizenship Requirement for Voting Amendment,voting policy measure,https://ballotpedia.org/South_Carolina_2024_ballot_measures,provide in state constitution that only a citizen (rather than every citizen) of the US may vote
South Dakota,46,,,,Ballot Initiative,Civil Liberties,,,Constitutional Amendment E,lgbtq+,https://ballotpedia.org/South_Dakota_2024_ballot_measures,amend constitution changing male pronouns to gender-neutral terms or titles
South Dakota,46,,,,Ballot Initiative,Reproductive Rights,,,Constitutional Amendment G,abortion,https://ballotpedia.org/South_Dakota_2024_ballot_measures,provide state constitutional right to abortion with a trimester framework for regulations
South Dakota,46,,,,Ballot Initiative,Democracy Repair,,,Constitutional Amendment H,voting policy measure,https://ballotpedia.org/South_Dakota_2024_ballot_measures,"provide for top-2 primary elections for certain races, including certain federal races"
South Dakota,46,,,,Ballot Initiative,Civil Liberties,,,Initiated Measure 29,marijuana,https://ballotpedia.org/South_Dakota_2024_ballot_measures,"legalize the recreational use, possession, and distribution of marijuana"
Utah,49,,,,Ballot Initiative,Democracy Repair,,,Elections of County Sheriffs Amendment,state government,https://ballotpedia.org/Utah_2024_ballot_measures,provide for elections of county sheriffs to serve 4 year terms
Wisconsin,55,,,,Ballot Initiative,Democracy Repair,,,Citizenship Voting Requirement Amendment,voting policy measure,https://ballotpedia.org/Wisconsin_2024_ballot_measures,"states only US citizens who are 18 years old or older can vote in federal, state, local, or school elections"
